{
  "PK": "OUTBOX#77777777-7777-4777-8777-777777777777",
  "entityType": "OutboxEvent",
  "eventId": "77777777-7777-4777-8777-777777777777",
  "eventType": "FirmPendingUpdatesChanged",
  "schemaVersion": 1,
  "occurredAt": "2026-10-22T10:00:05Z",
  "payload": {
    "firmId": "22222222-2222-4222-8222-222222222222",
    "templateId": "33333333-3333-4333-8333-333333333333",
    "publishId": "66666666-6666-4666-8666-666666666666",
    "pendingDelta": 3,
    "unclassifiedDelta": 0,
    "occurredAt": "2026-10-22T10:00:05Z"
  },
  "ttl": 1792483205,
  "version": 1,
  "createdBy": "00000000-0000-4000-8000-000000000001",
  "createdAt": "2026-10-22T10:00:00Z",
  "updatedBy": "00000000-0000-4000-8000-000000000001",
  "updatedAt": "2026-10-22T10:00:05Z",
  "state": "PENDING"
}
